{
  "$schema": "https://json-schema.org/draft/2020-12/schema",
  "$id": "urn:ser:04:request:1",
  "type": "object",
  "additionalProperties": false,
  "required": [
    "schema_version",
    "profile",
    "synthetic",
    "population_id",
    "unit",
    "question",
    "hypothesis",
    "estimand",
    "independence",
    "multiple_testing",
    "alpha",
    "reference",
    "comparison",
    "requested_effect"
  ],
  "properties": {
    "schema_version": {
      "const": "SER04-REQUEST-1"
    },
    "profile": {
      "const": "TWO_SAMPLE_KS_PILOT_V1"
    },
    "synthetic": {
      "const": true
    },
    "population_id": {
      "type": "string",
      "minLength": 1
    },
    "unit": {
      "type": "string",
      "minLength": 1
    },
    "question": {
      "type": "string",
      "minLength": 1
    },
    "hypothesis": {
      "const": "TWO_SIDED_DISTRIBUTION_DIFFERENCE"
    },
    "estimand": {
      "const": "MAX_ABSOLUTE_ECDF_DIFFERENCE"
    },
    "independence": {
      "const": "TWO_INDEPENDENT_IID_CONTINUOUS_SAMPLES_NO_TIES"
    },
    "multiple_testing": {
      "const": "ONE_PREREGISTERED_COMPARISON_NOT_APPLICABLE"
    },
    "alpha": {
      "type": "number",
      "exclusiveMinimum": 0,
      "exclusiveMaximum": 1
    },
    "reference": {
      "type": "array",
      "minItems": 4,
      "maxItems": 10000,
      "items": {
        "type": "number"
      }
    },
    "comparison": {
      "type": "array",
      "minItems": 4,
      "maxItems": 10000,
      "items": {
        "type": "number"
      }
    },
    "requested_effect": {
      "const": "NONE"
    }
  }
}
