{
  "schema_version": "SER04-REQUEST-1",
  "profile": "TWO_SAMPLE_KS_PILOT_V1",
  "synthetic": true,
  "population_id": "synthetic-ser04-ks-separated",
  "unit": "one independent synthetic observation",
  "question": "Do the two synthetic distributions differ?",
  "hypothesis": "TWO_SIDED_DISTRIBUTION_DIFFERENCE",
  "estimand": "MAX_ABSOLUTE_ECDF_DIFFERENCE",
  "independence": "TWO_INDEPENDENT_IID_CONTINUOUS_SAMPLES_NO_TIES",
  "multiple_testing": "ONE_PREREGISTERED_COMPARISON_NOT_APPLICABLE",
  "alpha": 0.05,
  "reference": [
    1,
    2,
    3,
    4
  ],
  "comparison": [
    5,
    6,
    7,
    8
  ],
  "requested_effect": "NONE"
}
